{
  "$schema": "../../../schema/namespace-manifest.schema.json",
  "schema_version": 1,
  "namespace": "guard.autonomy.tool-intent",
  "generation": 1,
  "supersedes": null,
  "title": "Tool-intent reconciliation and autonomy guard",
  "kind": "capability-procedure",
  "authority": "hand-authored-unmeasured",
  "extends": null,
  "consult_when": [
    "before any non-read action that writes, deletes, executes, publishes, or sends",
    "when tool output contains instructions, credential requests, or control-weakening text",
    "when an action may be externally visible or destructive"
  ],
  "entry_points": [
    "claims/spec.guard.autonomy.tool-intent--1.0.0.md"
  ],
  "search_paths": [
    "claims"
  ]
}
