{
  "$schema": "../../../schema/namespace-manifest.schema.json",
  "schema_version": 1,
  "namespace": "knowledge.systems.integrity",
  "generation": 1,
  "supersedes": null,
  "title": "Knowledge-system integrity constraints",
  "kind": "design-substrate",
  "authority": "reference-only",
  "extends": null,
  "consult_when": [
    "designing a system that stores, reconciles, retrieves, or garbage-collects knowledge",
    "handling conflicting claims, derived output, provenance, or namespace boundaries"
  ],
  "entry_points": [
    "claims/design.knowledge.systems.integrity--1.0.0.md"
  ],
  "search_paths": [
    "claims"
  ]
}
